{
  "schema_version": "human-subjects-authority-registry/1.0",
  "registry_id": "human-subjects-authority-v1",
  "registry_version": "2026-08-09",
  "as_of": "2026-08-09",
  "fact_definitions": [
    {
      "fact_id": "activity.human_subjects",
      "value_type": "boolean",
      "allowed_values": null,
      "description": "User declaration that the activity involves human subjects; omission or null remains unknown."
    },
    {
      "fact_id": "support.us_hhs_or_common_rule",
      "value_type": "boolean",
      "allowed_values": null,
      "description": "User declaration that U.S. HHS support, Common Rule assurance, or another identified basis places the activity within the selected Common Rule scope."
    },
    {
      "fact_id": "scope.tw_hsra",
      "value_type": "boolean",
      "allowed_values": null,
      "description": "User declaration that Taiwan's Human Subjects Research Act is an identified review authority for the activity."
    },
    {
      "fact_id": "scope.eu_gdpr",
      "value_type": "boolean",
      "allowed_values": null,
      "description": "User declaration that the GDPR is an identified data-protection authority for the processing."
    },
    {
      "fact_id": "processing.personal_data",
      "value_type": "boolean",
      "allowed_values": null,
      "description": "User declaration that the activity processes personal data within the selected GDPR scope."
    },
    {
      "fact_id": "data.special_category",
      "value_type": "boolean",
      "allowed_values": null,
      "description": "User declaration that the processing includes special categories of personal data."
    },
    {
      "fact_id": "data.collected_from_subject",
      "value_type": "boolean",
      "allowed_values": null,
      "description": "User declaration that the personal data is obtained from the data subject; false indicates it is obtained elsewhere, while omission or null remains unknown."
    },
    {
      "fact_id": "purpose.scientific_research",
      "value_type": "boolean",
      "allowed_values": null,
      "description": "User declaration that the processing purpose includes scientific research."
    },
    {
      "fact_id": "gdpr.member_state_research_law_identified",
      "value_type": "boolean",
      "allowed_values": null,
      "description": "User declaration that a specific applicable Union or Member State law supporting a claimed research derogation has been identified."
    }
  ],
  "sources": [
    {
      "source_id": "us.ecfr.45-cfr-46.107",
      "title": "45 CFR 46.107 — IRB membership",
      "publisher": "U.S. Government Publishing Office eCFR",
      "canonical_url": "https://www.ecfr.gov/current/title-45/subtitle-A/subchapter-A/part-46/subpart-A/section-46.107",
      "snapshot_url": null,
      "provision_locator": "45 CFR 46.107",
      "allowed_provisions": [
        "45 CFR 46.107"
      ],
      "effective_from": "2018-07-19",
      "effective_until": null,
      "source_amended_or_published_date": "2017-01-19",
      "retrieved_at": "2026-08-09",
      "verified_at": "2026-08-09",
      "source_language": "en",
      "controlling_language": true,
      "authenticity_status": "authoritative_unofficial",
      "content_digest": null,
      "digest_scope": "not_recorded",
      "rights_status": "link_only",
      "freshness": "current"
    },
    {
      "source_id": "us.ecfr.45-cfr-46.116",
      "title": "45 CFR 46.116 — General requirements for informed consent",
      "publisher": "U.S. Government Publishing Office eCFR",
      "canonical_url": "https://www.ecfr.gov/current/title-45/subtitle-A/subchapter-A/part-46/subpart-A/section-46.116",
      "snapshot_url": null,
      "provision_locator": "45 CFR 46.116",
      "allowed_provisions": [
        "45 CFR 46.116"
      ],
      "effective_from": "2018-07-19",
      "effective_until": null,
      "source_amended_or_published_date": "2017-01-19",
      "retrieved_at": "2026-08-09",
      "verified_at": "2026-08-09",
      "source_language": "en",
      "controlling_language": true,
      "authenticity_status": "authoritative_unofficial",
      "content_digest": null,
      "digest_scope": "not_recorded",
      "rights_status": "link_only",
      "freshness": "current"
    },
    {
      "source_id": "tw.moj.hsra.article-7.zh-hant",
      "title": "Human Subjects Research Act — Article 7 (controlling Chinese text)",
      "publisher": "Taiwan Ministry of Justice Laws and Regulations Database",
      "canonical_url": "https://law.moj.gov.tw/LawClass/LawAll.aspx?pcode=L0020176",
      "snapshot_url": null,
      "provision_locator": "人體研究法第 7 條",
      "allowed_provisions": [
        "人體研究法第 7 條"
      ],
      "effective_from": "2011-12-28",
      "effective_until": null,
      "source_amended_or_published_date": "2019-01-02",
      "retrieved_at": "2026-08-09",
      "verified_at": "2026-08-09",
      "source_language": "zh-Hant-TW",
      "controlling_language": true,
      "authenticity_status": "official_controlling_language",
      "content_digest": null,
      "digest_scope": "not_recorded",
      "rights_status": "link_only",
      "freshness": "current"
    },
    {
      "source_id": "tw.moj.hsra.article-14.zh-hant",
      "title": "Human Subjects Research Act — Article 14 (controlling Chinese text)",
      "publisher": "Taiwan Ministry of Justice Laws and Regulations Database",
      "canonical_url": "https://law.moj.gov.tw/LawClass/LawAll.aspx?pcode=L0020176",
      "snapshot_url": null,
      "provision_locator": "人體研究法第 14 條",
      "allowed_provisions": [
        "人體研究法第 14 條"
      ],
      "effective_from": "2011-12-28",
      "effective_until": null,
      "source_amended_or_published_date": "2019-01-02",
      "retrieved_at": "2026-08-09",
      "verified_at": "2026-08-09",
      "source_language": "zh-Hant-TW",
      "controlling_language": true,
      "authenticity_status": "official_controlling_language",
      "content_digest": null,
      "digest_scope": "not_recorded",
      "rights_status": "link_only",
      "freshness": "current"
    },
    {
      "source_id": "tw.moj.hsra.english-reference",
      "title": "Human Subjects Research Act (official English reference translation)",
      "publisher": "Taiwan Ministry of Justice Laws and Regulations Database",
      "canonical_url": "https://law.moj.gov.tw/ENG/LawClass/LawAll.aspx?pcode=L0020176",
      "snapshot_url": null,
      "provision_locator": "Articles 7 and 14 (reference translation)",
      "allowed_provisions": [
        "Human Subjects Research Act Article 7",
        "Human Subjects Research Act Article 14"
      ],
      "effective_from": "2011-12-28",
      "effective_until": null,
      "source_amended_or_published_date": "2019-01-02",
      "retrieved_at": "2026-08-09",
      "verified_at": "2026-08-09",
      "source_language": "en",
      "controlling_language": false,
      "authenticity_status": "official_reference_translation",
      "content_digest": null,
      "digest_scope": "not_recorded",
      "rights_status": "link_only",
      "freshness": "current"
    },
    {
      "source_id": "eu.eur-lex.gdpr.2016-679",
      "title": "Regulation (EU) 2016/679",
      "publisher": "EUR-Lex, Publications Office of the European Union",
      "canonical_url": "https://eur-lex.europa.eu/eli/reg/2016/679/2016-05-04/eng",
      "snapshot_url": null,
      "provision_locator": "Articles 6, 9, 13, 14, and 89",
      "allowed_provisions": [
        "GDPR Article 6",
        "GDPR Article 9",
        "GDPR Article 13",
        "GDPR Article 14",
        "GDPR Article 89(1)",
        "GDPR Article 89(2)"
      ],
      "effective_from": "2018-05-25",
      "effective_until": null,
      "source_amended_or_published_date": "2016-05-04",
      "retrieved_at": "2026-08-09",
      "verified_at": "2026-08-09",
      "source_language": "en",
      "controlling_language": true,
      "authenticity_status": "authentic_official",
      "content_digest": null,
      "digest_scope": "not_recorded",
      "rights_status": "link_only",
      "freshness": "current"
    }
  ],
  "profiles": [
    {
      "profile_id": "us.hhs.45-cfr-46.subpart-a",
      "profile_version": "2019-01-21",
      "profile_digest": "46fd0b39b1ca1706363e1163c2b4a1149bb2ff22fc2f64c5426fc3ec8b6b0fd4",
      "axis": "review_ethics",
      "authority_scope_ids": [
        "us.common-rule"
      ],
      "title": "U.S. Common Rule review-ethics profile (bounded subset)",
      "authority_level": "national",
      "coverage_status": "bounded_subset",
      "covered_provisions": [
        "45 CFR 46.107 IRB membership",
        "45 CFR 46.116 general informed-consent requirements"
      ],
      "known_exclusions": [
        "45 CFR 46 Subparts B through E and FDA human-subject protection rules are outside this profile.",
        "Exemption, limited-review, expedited-review, waiver, and alteration pathways are not exhaustively profiled.",
        "State, local, tribal, foreign, institutional, and funder requirements are not supplied by this base profile."
      ],
      "known_gaps": [
        "This profile does not encode every condition in 45 CFR 46.101 through 46.124.",
        "Institution-specific assurance, registration, roster, and submission procedures require separate authority records.",
        "The profile version records the 2019-01-21 general compliance date; source and requirement effective dates separately record the revised rule's 2018-07-19 effective date, and publication is recorded as 2017-01-19."
      ],
      "no_completeness_claim": true,
      "source_ids": [
        "us.ecfr.45-cfr-46.107",
        "us.ecfr.45-cfr-46.116"
      ],
      "applies_if": {
        "op": "all",
        "operands": [
          {
            "op": "fact_equals",
            "fact_id": "activity.human_subjects",
            "value": true
          },
          {
            "op": "fact_equals",
            "fact_id": "support.us_hhs_or_common_rule",